{
  "schema_version": "home-tutor.question-package.v1",
  "session_id": "a1000002-0002-4002-8002-000000000002",
  "question_id": "q07",
  "grade_level": "primary",
  "subject": "math",
  "page_id": "page_1",
  "index_on_page": 7,
  "number": 7,
  "question_type": "fill_blank",
  "status": "complete",
  "updated_at": "2026-06-30T09:42:38.000Z",
  "prompt": {
    "text": "16千克铁的1/4和8千克棉花的3/4一样重。（　）"
  },
  "layout": {
    "regions": [
      {
        "region_id": "r_prompt_q07",
        "role": "printed_prompt",
        "bbox": {
          "x": 0.53,
          "y": 0.08,
          "w": 0.42,
          "h": 0.1
        }
      },
      {
        "region_id": "r_answer_q07",
        "role": "student_answer",
        "bbox": {
          "x": 0.761,
          "y": 0.135,
          "w": 0.18,
          "h": 0.04
        }
      },
      {
        "region_id": "r_scratch_q07",
        "role": "scratch_work",
        "bbox": {
          "x": 0.55,
          "y": 0.105,
          "w": 0.35,
          "h": 0.06
        }
      }
    ]
  },
  "answer_timeline": [
    {
      "t_offset_ms": 707448,
      "kind": "appeared",
      "text": "×",
      "frame_id": "frame_00027",
      "confidence": 0.92
    }
  ],
  "final_answer": {
    "text": "×",
    "confidence": 0.92
  },
  "focus_segments": [
    {
      "segment_index": 1,
      "start_ms": 682948,
      "end_ms": 739625,
      "duration_ms": 56677
    }
  ],
  "process_metrics": {
    "first_touch_ms": 682948,
    "last_change_ms": 707448,
    "active_duration_ms": 56677,
    "idle_periods_ms": [],
    "revision_count": 0,
    "stuck": false
  },
  "scratch_work": [],
  "key_moments": [
    {
      "label": "final_answer",
      "t_offset_ms": 707448,
      "frame_id": "frame_00027"
    }
  ]
}