{
  "schema_version": "home-tutor.question-package.v1",
  "session_id": "a1000002-0002-4002-8002-000000000002",
  "question_id": "q02",
  "grade_level": "primary",
  "subject": "math",
  "page_id": "page_1",
  "index_on_page": 2,
  "number": 2,
  "question_type": "fill_blank",
  "status": "complete",
  "updated_at": "2026-06-30T09:42:38.000Z",
  "prompt": {
    "text": "（　）米的2/5是12米，36kg比（　）kg多1/2。"
  },
  "layout": {
    "regions": [
      {
        "region_id": "r_prompt_q02",
        "role": "printed_prompt",
        "bbox": {
          "x": 0.05,
          "y": 0.22,
          "w": 0.42,
          "h": 0.1
        }
      },
      {
        "region_id": "r_answer_q02",
        "role": "student_answer",
        "bbox": {
          "x": 0.281,
          "y": 0.275,
          "w": 0.18,
          "h": 0.04
        }
      },
      {
        "region_id": "r_scratch_q02",
        "role": "scratch_work",
        "bbox": {
          "x": 0.07,
          "y": 0.245,
          "w": 0.35,
          "h": 0.06
        }
      }
    ]
  },
  "answer_timeline": [
    {
      "t_offset_ms": 123171,
      "kind": "appeared",
      "text": "30；24",
      "frame_id": "frame_00009",
      "confidence": 0.92
    }
  ],
  "final_answer": {
    "text": "30；24",
    "confidence": 0.92
  },
  "focus_segments": [
    {
      "segment_index": 1,
      "start_ms": 68671,
      "end_ms": 176659,
      "duration_ms": 107988
    }
  ],
  "process_metrics": {
    "first_touch_ms": 68671,
    "last_change_ms": 123171,
    "active_duration_ms": 107988,
    "idle_periods_ms": [],
    "revision_count": 0,
    "stuck": false
  },
  "scratch_work": [
    {
      "text": "30",
      "region_id": "r_scratch_q02",
      "confidence": 0.92
    }
  ],
  "key_moments": [
    {
      "label": "final_answer",
      "t_offset_ms": 123171,
      "frame_id": "frame_00009"
    }
  ]
}