{
  "schema_version": "home-tutor.question-package.v1",
  "session_id": "b2000002-0002-4002-8002-000000000002",
  "question_id": "q26",
  "grade_level": "primary",
  "subject": "math",
  "page_id": "page_3",
  "index_on_page": 4,
  "number": 26,
  "question_type": "word_problem",
  "status": "complete",
  "updated_at": "2026-06-30T09:42:38.000Z",
  "prompt": {
    "text": "长城全长21200km，明朝6200km，秦朝是汉朝的1/2，求秦、汉长度。"
  },
  "layout": {
    "regions": [
      {
        "region_id": "r_prompt_q26",
        "role": "printed_prompt",
        "bbox": {
          "x": 0.05,
          "y": 0.5,
          "w": 0.42,
          "h": 0.1
        }
      },
      {
        "region_id": "r_answer_q26",
        "role": "student_answer",
        "bbox": {
          "x": 0.281,
          "y": 0.555,
          "w": 0.18,
          "h": 0.04
        }
      },
      {
        "region_id": "r_scratch_q26",
        "role": "scratch_work",
        "bbox": {
          "x": 0.07,
          "y": 0.525,
          "w": 0.35,
          "h": 0.06
        }
      }
    ]
  },
  "answer_timeline": [
    {
      "t_offset_ms": 2783613,
      "kind": "appeared",
      "text": "秦朝5000km；汉朝10000km",
      "frame_id": "frame_00094",
      "confidence": 0.92
    }
  ],
  "final_answer": {
    "text": "秦朝5000km；汉朝10000km",
    "confidence": 0.92
  },
  "focus_segments": [
    {
      "segment_index": 1,
      "start_ms": 2729113,
      "end_ms": 2875481,
      "duration_ms": 146368
    }
  ],
  "process_metrics": {
    "first_touch_ms": 2729113,
    "last_change_ms": 2783613,
    "active_duration_ms": 146368,
    "idle_periods_ms": [],
    "revision_count": 0,
    "stuck": false
  },
  "scratch_work": [
    {
      "text": "秦朝5000km",
      "region_id": "r_scratch_q26",
      "confidence": 0.92
    }
  ],
  "key_moments": [
    {
      "label": "final_answer",
      "t_offset_ms": 2783613,
      "frame_id": "frame_00094"
    }
  ]
}