{
  "schema_version": "home-tutor.question-package.v1",
  "session_id": "b2000001-0001-4001-8001-000000000001",
  "question_id": "q25",
  "grade_level": "primary",
  "subject": "math",
  "page_id": "page_3",
  "index_on_page": 3,
  "number": 25,
  "question_type": "word_problem",
  "status": "complete",
  "updated_at": "2026-06-30T09:42:38.000Z",
  "prompt": {
    "text": "粉碎机每小时粉碎3/5吨，2/3小时可粉碎多少吨？25分钟可粉碎多少吨？"
  },
  "layout": {
    "regions": [
      {
        "region_id": "r_prompt_q25",
        "role": "printed_prompt",
        "bbox": {
          "x": 0.05,
          "y": 0.36,
          "w": 0.42,
          "h": 0.1
        }
      },
      {
        "region_id": "r_answer_q25",
        "role": "student_answer",
        "bbox": {
          "x": 0.281,
          "y": 0.415,
          "w": 0.18,
          "h": 0.04
        }
      },
      {
        "region_id": "r_scratch_q25",
        "role": "scratch_work",
        "bbox": {
          "x": 0.07,
          "y": 0.385,
          "w": 0.35,
          "h": 0.06
        }
      }
    ]
  },
  "answer_timeline": [
    {
      "t_offset_ms": 2717157,
      "kind": "appeared",
      "text": "2/5吨；5/36吨",
      "frame_id": "frame_00090",
      "confidence": 0.92
    }
  ],
  "final_answer": {
    "text": "2/5吨；5/36吨",
    "confidence": 0.92
  },
  "focus_segments": [
    {
      "segment_index": 1,
      "start_ms": 2662657,
      "end_ms": 2774344,
      "duration_ms": 111687
    }
  ],
  "process_metrics": {
    "first_touch_ms": 2662657,
    "last_change_ms": 2717157,
    "active_duration_ms": 111687,
    "idle_periods_ms": [],
    "revision_count": 0,
    "stuck": false
  },
  "scratch_work": [
    {
      "text": "2/5吨",
      "region_id": "r_scratch_q25",
      "confidence": 0.92
    }
  ],
  "key_moments": [
    {
      "label": "final_answer",
      "t_offset_ms": 2717157,
      "frame_id": "frame_00090"
    }
  ]
}