{
  "schema_version": "home-tutor.question-package.v1",
  "session_id": "c3000001-0001-4001-8001-000000000001",
  "question_id": "q06",
  "grade_level": "primary",
  "subject": "math",
  "page_id": "page_1",
  "index_on_page": 6,
  "number": 6,
  "question_type": "fill_blank",
  "status": "complete",
  "updated_at": "2026-06-30T09:42:38.000Z",
  "prompt": {
    "text": "按规律继续画下去，第（6）个图形共有　个。"
  },
  "layout": {
    "regions": [
      {
        "region_id": "r_prompt_q06",
        "role": "printed_prompt",
        "bbox": {
          "x": 0.05,
          "y": 0.78,
          "w": 0.42,
          "h": 0.1
        }
      },
      {
        "region_id": "r_answer_q06",
        "role": "student_answer",
        "bbox": {
          "x": 0.281,
          "y": 0.835,
          "w": 0.18,
          "h": 0.04
        }
      },
      {
        "region_id": "r_scratch_q06",
        "role": "scratch_work",
        "bbox": {
          "x": 0.07,
          "y": 0.805,
          "w": 0.35,
          "h": 0.06
        }
      }
    ]
  },
  "answer_timeline": [
    {
      "t_offset_ms": 410880,
      "kind": "appeared",
      "text": "25",
      "frame_id": "frame_00024",
      "confidence": 0.92
    }
  ],
  "final_answer": {
    "text": "25",
    "confidence": 0.92
  },
  "focus_segments": [
    {
      "segment_index": 1,
      "start_ms": 386380,
      "end_ms": 659183,
      "duration_ms": 272803
    }
  ],
  "process_metrics": {
    "first_touch_ms": 386380,
    "last_change_ms": 410880,
    "active_duration_ms": 272803,
    "idle_periods_ms": [],
    "revision_count": 0,
    "stuck": false
  },
  "scratch_work": [],
  "key_moments": [
    {
      "label": "final_answer",
      "t_offset_ms": 410880,
      "frame_id": "frame_00024"
    }
  ]
}