{
  "schema_version": "home-tutor.question-package.v1",
  "session_id": "c3000001-0001-4001-8001-000000000001",
  "question_id": "q12",
  "grade_level": "primary",
  "subject": "math",
  "page_id": "page_1",
  "index_on_page": 12,
  "number": 12,
  "question_type": "multiple_choice",
  "status": "complete",
  "updated_at": "2026-06-30T09:42:38.000Z",
  "prompt": {
    "text": "K5路公交：有1/5的人下车，又上来此时车上人数的1/5，上车与下车人数相比（　）。",
    "options": [
      {
        "key": "A",
        "text": "上车的人数多"
      },
      {
        "key": "B",
        "text": "下车的人数多"
      },
      {
        "key": "C",
        "text": "同样多"
      },
      {
        "key": "D",
        "text": "无法确定"
      }
    ]
  },
  "layout": {
    "regions": [
      {
        "region_id": "r_prompt_q12",
        "role": "printed_prompt",
        "bbox": {
          "x": 0.53,
          "y": 0.78,
          "w": 0.42,
          "h": 0.1
        }
      },
      {
        "region_id": "r_answer_q12",
        "role": "student_answer",
        "bbox": {
          "x": 0.761,
          "y": 0.835,
          "w": 0.18,
          "h": 0.04
        }
      },
      {
        "region_id": "r_scratch_q12",
        "role": "scratch_work",
        "bbox": {
          "x": 0.55,
          "y": 0.805,
          "w": 0.35,
          "h": 0.06
        }
      }
    ]
  },
  "answer_timeline": [
    {
      "t_offset_ms": 960318,
      "kind": "appeared",
      "text": "B",
      "frame_id": "frame_00042",
      "confidence": 0.92
    }
  ],
  "final_answer": {
    "text": "B",
    "confidence": 0.92
  },
  "focus_segments": [
    {
      "segment_index": 1,
      "start_ms": 935818,
      "end_ms": 1040108,
      "duration_ms": 104290
    }
  ],
  "process_metrics": {
    "first_touch_ms": 935818,
    "last_change_ms": 960318,
    "active_duration_ms": 104290,
    "idle_periods_ms": [],
    "revision_count": 0,
    "stuck": false
  },
  "scratch_work": [],
  "key_moments": [
    {
      "label": "final_answer",
      "t_offset_ms": 960318,
      "frame_id": "frame_00042"
    }
  ]
}