{
  "schema_version": "home-tutor.question-package.v1",
  "session_id": "b2000001-0001-4001-8001-000000000001",
  "question_id": "q30",
  "grade_level": "primary",
  "subject": "math",
  "page_id": "page_4",
  "index_on_page": 3,
  "number": 30,
  "question_type": "word_problem",
  "status": "complete",
  "updated_at": "2026-06-30T09:42:38.000Z",
  "prompt": {
    "text": "环保知识调查：补全统计表、求总人数、补全统计图。"
  },
  "layout": {
    "regions": [
      {
        "region_id": "r_prompt_q30",
        "role": "printed_prompt",
        "bbox": {
          "x": 0.05,
          "y": 0.36,
          "w": 0.42,
          "h": 0.1
        }
      },
      {
        "region_id": "r_answer_q30",
        "role": "student_answer",
        "bbox": {
          "x": 0.281,
          "y": 0.415,
          "w": 0.18,
          "h": 0.04
        }
      },
      {
        "region_id": "r_scratch_q30",
        "role": "scratch_work",
        "bbox": {
          "x": 0.07,
          "y": 0.385,
          "w": 0.35,
          "h": 0.06
        }
      }
    ]
  },
  "answer_timeline": [
    {
      "t_offset_ms": 3408469,
      "kind": "appeared",
      "text": "B15% D35% 共400人",
      "frame_id": "frame_00109",
      "confidence": 0.92
    }
  ],
  "final_answer": {
    "text": "B15% D35% 共400人",
    "confidence": 0.92
  },
  "focus_segments": [
    {
      "segment_index": 1,
      "start_ms": 3353969,
      "end_ms": 3653000,
      "duration_ms": 299031
    }
  ],
  "process_metrics": {
    "first_touch_ms": 3353969,
    "last_change_ms": 3408469,
    "active_duration_ms": 299031,
    "idle_periods_ms": [],
    "revision_count": 0,
    "stuck": false
  },
  "scratch_work": [
    {
      "text": "B15% D",
      "region_id": "r_scratch_q30",
      "confidence": 0.92
    }
  ],
  "key_moments": [
    {
      "label": "final_answer",
      "t_offset_ms": 3408469,
      "frame_id": "frame_00109"
    }
  ]
}