{
  "schema_version": "home-tutor.question-package.v1",
  "session_id": "c3000002-0002-4002-8002-000000000002",
  "question_id": "q16",
  "grade_level": "primary",
  "subject": "math",
  "page_id": "page_1",
  "index_on_page": 16,
  "number": 16,
  "question_type": "multiple_choice",
  "status": "complete",
  "updated_at": "2026-06-30T09:42:38.000Z",
  "prompt": {
    "text": "周长31.4cm的圆，圆规两脚间距离（　）cm。",
    "options": [
      {
        "key": "A",
        "text": "5"
      },
      {
        "key": "B",
        "text": "10"
      },
      {
        "key": "C",
        "text": "11"
      },
      {
        "key": "D",
        "text": "15.7"
      }
    ]
  },
  "layout": {
    "regions": [
      {
        "region_id": "r_prompt_q16",
        "role": "printed_prompt",
        "bbox": {
          "x": 1.01,
          "y": 0.5,
          "w": 0.42,
          "h": 0.1
        }
      },
      {
        "region_id": "r_answer_q16",
        "role": "student_answer",
        "bbox": {
          "x": 1.241,
          "y": 0.555,
          "w": 0.18,
          "h": 0.04
        }
      },
      {
        "region_id": "r_scratch_q16",
        "role": "scratch_work",
        "bbox": {
          "x": 1.03,
          "y": 0.525,
          "w": 0.35,
          "h": 0.06
        }
      }
    ]
  },
  "answer_timeline": [
    {
      "t_offset_ms": 1388248,
      "kind": "appeared",
      "text": "A",
      "frame_id": "frame_00054",
      "confidence": 0.92
    }
  ],
  "final_answer": {
    "text": "A",
    "confidence": 0.92
  },
  "focus_segments": [
    {
      "segment_index": 1,
      "start_ms": 1363748,
      "end_ms": 1419450,
      "duration_ms": 55702
    }
  ],
  "process_metrics": {
    "first_touch_ms": 1363748,
    "last_change_ms": 1388248,
    "active_duration_ms": 55702,
    "idle_periods_ms": [],
    "revision_count": 0,
    "stuck": false
  },
  "scratch_work": [],
  "key_moments": [
    {
      "label": "final_answer",
      "t_offset_ms": 1388248,
      "frame_id": "frame_00054"
    }
  ]
}