{
  "schema_version": "home-tutor.question-package.v1",
  "session_id": "b2000002-0002-4002-8002-000000000002",
  "question_id": "q24",
  "grade_level": "primary",
  "subject": "math",
  "page_id": "page_3",
  "index_on_page": 2,
  "number": 24,
  "question_type": "calculation",
  "status": "complete",
  "updated_at": "2026-06-30T09:42:38.000Z",
  "prompt": {
    "text": "长6cm宽4cm的长方形内画最大圆，求面积（保留找圆心痕迹）。"
  },
  "layout": {
    "regions": [
      {
        "region_id": "r_prompt_q24",
        "role": "printed_prompt",
        "bbox": {
          "x": 0.05,
          "y": 0.22,
          "w": 0.42,
          "h": 0.1
        }
      },
      {
        "region_id": "r_answer_q24",
        "role": "student_answer",
        "bbox": {
          "x": 0.281,
          "y": 0.275,
          "w": 0.18,
          "h": 0.04
        }
      },
      {
        "region_id": "r_scratch_q24",
        "role": "scratch_work",
        "bbox": {
          "x": 0.07,
          "y": 0.245,
          "w": 0.35,
          "h": 0.06
        }
      }
    ]
  },
  "answer_timeline": [
    {
      "t_offset_ms": 2562938,
      "kind": "appeared",
      "text": "12.56cm²",
      "frame_id": "frame_00086",
      "confidence": 0.92
    }
  ],
  "final_answer": {
    "text": "12.56cm²",
    "confidence": 0.92
  },
  "focus_segments": [
    {
      "segment_index": 1,
      "start_ms": 2508438,
      "end_ms": 2618275,
      "duration_ms": 109837
    }
  ],
  "process_metrics": {
    "first_touch_ms": 2508438,
    "last_change_ms": 2562938,
    "active_duration_ms": 109837,
    "idle_periods_ms": [],
    "revision_count": 0,
    "stuck": false
  },
  "scratch_work": [
    {
      "text": "12.56c",
      "region_id": "r_scratch_q24",
      "confidence": 0.92
    }
  ],
  "key_moments": [
    {
      "label": "final_answer",
      "t_offset_ms": 2562938,
      "frame_id": "frame_00086"
    }
  ]
}