{
  "schema_version": "home-tutor.question-package.v1",
  "session_id": "b2000001-0001-4001-8001-000000000001",
  "question_id": "q01",
  "grade_level": "primary",
  "subject": "math",
  "page_id": "page_1",
  "index_on_page": 1,
  "number": 1,
  "question_type": "fill_blank",
  "status": "complete",
  "updated_at": "2026-06-30T09:42:38.000Z",
  "prompt": {
    "text": "新苗幼儿园大班有男孩126人，女孩84人。中班人数是大班人数的6/7。新苗幼儿园中班有　人。"
  },
  "layout": {
    "regions": [
      {
        "region_id": "r_prompt_q01",
        "role": "printed_prompt",
        "bbox": {
          "x": 0.05,
          "y": 0.08,
          "w": 0.42,
          "h": 0.1
        }
      },
      {
        "region_id": "r_answer_q01",
        "role": "student_answer",
        "bbox": {
          "x": 0.281,
          "y": 0.135,
          "w": 0.18,
          "h": 0.04
        }
      },
      {
        "region_id": "r_scratch_q01",
        "role": "scratch_work",
        "bbox": {
          "x": 0.07,
          "y": 0.105,
          "w": 0.35,
          "h": 0.06
        }
      }
    ]
  },
  "answer_timeline": [
    {
      "t_offset_ms": 66370,
      "kind": "appeared",
      "text": "180",
      "frame_id": "frame_00005",
      "confidence": 0.92
    }
  ],
  "final_answer": {
    "text": "180",
    "confidence": 0.92
  },
  "focus_segments": [
    {
      "segment_index": 1,
      "start_ms": 11870,
      "end_ms": 70495,
      "duration_ms": 58625
    }
  ],
  "process_metrics": {
    "first_touch_ms": 11870,
    "last_change_ms": 66370,
    "active_duration_ms": 58625,
    "idle_periods_ms": [],
    "revision_count": 0,
    "stuck": false
  },
  "scratch_work": [
    {
      "text": "126+84=210",
      "region_id": "r_scratch_q01",
      "confidence": 0.92
    },
    {
      "text": "210×6/7",
      "region_id": "r_scratch_q01",
      "confidence": 0.92
    }
  ],
  "key_moments": [
    {
      "label": "final_answer",
      "t_offset_ms": 66370,
      "frame_id": "frame_00005"
    }
  ]
}