{
  "schema_version": "home-tutor.question-package.v1",
  "session_id": "c3000003-0003-4003-8003-000000000003",
  "question_id": "q17",
  "grade_level": "primary",
  "subject": "math",
  "page_id": "page_1",
  "index_on_page": 17,
  "number": 17,
  "question_type": "multiple_choice",
  "status": "complete",
  "updated_at": "2026-06-30T09:42:38.000Z",
  "prompt": {
    "text": "上衣先提价20%再降价20%，现价与原价相比（　）。",
    "options": [
      {
        "key": "A",
        "text": "不变"
      },
      {
        "key": "B",
        "text": "降低了40%"
      },
      {
        "key": "C",
        "text": "降低了4%"
      },
      {
        "key": "D",
        "text": "提高了4%"
      }
    ]
  },
  "layout": {
    "regions": [
      {
        "region_id": "r_prompt_q17",
        "role": "printed_prompt",
        "bbox": {
          "x": 1.01,
          "y": 0.64,
          "w": 0.42,
          "h": 0.1
        }
      },
      {
        "region_id": "r_answer_q17",
        "role": "student_answer",
        "bbox": {
          "x": 1.241,
          "y": 0.695,
          "w": 0.18,
          "h": 0.04
        }
      },
      {
        "region_id": "r_scratch_q17",
        "role": "scratch_work",
        "bbox": {
          "x": 1.03,
          "y": 0.665,
          "w": 0.35,
          "h": 0.06
        }
      }
    ]
  },
  "answer_timeline": [
    {
      "t_offset_ms": 1370605,
      "kind": "appeared",
      "text": "A",
      "frame_id": "frame_00057",
      "confidence": 0.92
    }
  ],
  "final_answer": {
    "text": "A",
    "confidence": 0.92
  },
  "focus_segments": [
    {
      "segment_index": 1,
      "start_ms": 1346105,
      "end_ms": 1446697,
      "duration_ms": 100592
    }
  ],
  "process_metrics": {
    "first_touch_ms": 1346105,
    "last_change_ms": 1370605,
    "active_duration_ms": 100592,
    "idle_periods_ms": [],
    "revision_count": 0,
    "stuck": false
  },
  "scratch_work": [],
  "key_moments": [
    {
      "label": "final_answer",
      "t_offset_ms": 1370605,
      "frame_id": "frame_00057"
    }
  ]
}