{
  "schema_version": "home-tutor.question-package.v1",
  "session_id": "a1000002-0002-4002-8002-000000000002",
  "question_id": "q27",
  "grade_level": "primary",
  "subject": "math",
  "page_id": "page_3",
  "index_on_page": 5,
  "number": 27,
  "question_type": "word_problem",
  "status": "complete",
  "updated_at": "2026-06-30T09:42:38.000Z",
  "prompt": {
    "text": "四五六年级共80件获奖，比2:3:5，六年级比四年级多多少件？"
  },
  "layout": {
    "regions": [
      {
        "region_id": "r_prompt_q27",
        "role": "printed_prompt",
        "bbox": {
          "x": 0.05,
          "y": 0.64,
          "w": 0.42,
          "h": 0.1
        }
      },
      {
        "region_id": "r_answer_q27",
        "role": "student_answer",
        "bbox": {
          "x": 0.281,
          "y": 0.695,
          "w": 0.18,
          "h": 0.04
        }
      },
      {
        "region_id": "r_scratch_q27",
        "role": "scratch_work",
        "bbox": {
          "x": 0.07,
          "y": 0.665,
          "w": 0.35,
          "h": 0.06
        }
      }
    ]
  },
  "answer_timeline": [
    {
      "t_offset_ms": 2852288,
      "kind": "appeared",
      "text": "24件",
      "frame_id": "frame_00096",
      "confidence": 0.92
    }
  ],
  "final_answer": {
    "text": "24件",
    "confidence": 0.92
  },
  "focus_segments": [
    {
      "segment_index": 1,
      "start_ms": 2827788,
      "end_ms": 2902790,
      "duration_ms": 75002
    }
  ],
  "process_metrics": {
    "first_touch_ms": 2827788,
    "last_change_ms": 2852288,
    "active_duration_ms": 75002,
    "idle_periods_ms": [],
    "revision_count": 0,
    "stuck": false
  },
  "scratch_work": [],
  "key_moments": [
    {
      "label": "final_answer",
      "t_offset_ms": 2852288,
      "frame_id": "frame_00096"
    }
  ]
}