{
  "schema_version": "home-tutor.question-package.v1",
  "session_id": "a1000000-0000-4000-8000-000000000000",
  "question_id": "q30",
  "grade_level": "primary",
  "subject": "math",
  "page_id": "page_4",
  "index_on_page": 3,
  "number": 30,
  "question_type": "word_problem",
  "status": "complete",
  "updated_at": "2026-06-30T09:42:37.000Z",
  "prompt": {
    "text": "环保知识调查：补全统计表、求总人数、补全统计图。"
  },
  "layout": {
    "regions": [
      {
        "region_id": "r_prompt_q30",
        "role": "printed_prompt",
        "bbox": {
          "x": 0.05,
          "y": 0.36,
          "w": 0.42,
          "h": 0.1
        }
      },
      {
        "region_id": "r_answer_q30",
        "role": "student_answer",
        "bbox": {
          "x": 0.281,
          "y": 0.415,
          "w": 0.18,
          "h": 0.04
        }
      },
      {
        "region_id": "r_scratch_q30",
        "role": "scratch_work",
        "bbox": {
          "x": 0.07,
          "y": 0.385,
          "w": 0.35,
          "h": 0.06
        }
      }
    ]
  },
  "answer_timeline": [
    {
      "t_offset_ms": 3463746,
      "kind": "appeared",
      "text": "总人数300；B20% D30%",
      "frame_id": "frame_00108",
      "confidence": 0.92
    }
  ],
  "final_answer": {
    "text": "总人数300；B20% D30%",
    "confidence": 0.92
  },
  "focus_segments": [
    {
      "segment_index": 1,
      "start_ms": 3409246,
      "end_ms": 3713000,
      "duration_ms": 303754
    }
  ],
  "process_metrics": {
    "first_touch_ms": 3409246,
    "last_change_ms": 3463746,
    "active_duration_ms": 303754,
    "idle_periods_ms": [
      {
        "start_ms": 3541046,
        "end_ms": 3635546,
        "duration_ms": 94500
      }
    ],
    "revision_count": 0,
    "stuck": true
  },
  "scratch_work": [
    {
      "text": "总人数300",
      "region_id": "r_scratch_q30",
      "confidence": 0.92
    }
  ],
  "key_moments": [
    {
      "label": "final_answer",
      "t_offset_ms": 3463746,
      "frame_id": "frame_00108"
    }
  ]
}