{
  "schema_version": "home-tutor.question-package.v1",
  "session_id": "a1000003-0003-4003-8003-000000000003",
  "question_id": "q28",
  "grade_level": "primary",
  "subject": "math",
  "page_id": "page_4",
  "index_on_page": 1,
  "number": 28,
  "question_type": "word_problem",
  "status": "complete",
  "updated_at": "2026-06-30T09:42:38.000Z",
  "prompt": {
    "text": "田径场：①阴影活动场地面积 ②最内圈跑1圈米数 ③400米赛第二道起跑线前移距离"
  },
  "layout": {
    "regions": [
      {
        "region_id": "r_prompt_q28",
        "role": "printed_prompt",
        "bbox": {
          "x": 0.05,
          "y": 0.08,
          "w": 0.42,
          "h": 0.1
        }
      },
      {
        "region_id": "r_answer_q28",
        "role": "student_answer",
        "bbox": {
          "x": 0.281,
          "y": 0.135,
          "w": 0.18,
          "h": 0.04
        }
      },
      {
        "region_id": "r_scratch_q28",
        "role": "scratch_work",
        "bbox": {
          "x": 0.07,
          "y": 0.105,
          "w": 0.35,
          "h": 0.06
        }
      }
    ]
  },
  "answer_timeline": [
    {
      "t_offset_ms": 2908311,
      "kind": "appeared",
      "text": "① 6500m²  ② 400m  ③ 3.14m",
      "frame_id": "frame_00102",
      "confidence": 0.92
    }
  ],
  "final_answer": {
    "text": "① 6500m²  ② 400m  ③ 3.14m",
    "confidence": 0.92
  },
  "focus_segments": [
    {
      "segment_index": 1,
      "start_ms": 2853811,
      "end_ms": 3131436,
      "duration_ms": 277625
    }
  ],
  "process_metrics": {
    "first_touch_ms": 2853811,
    "last_change_ms": 2908311,
    "active_duration_ms": 277625,
    "idle_periods_ms": [
      {
        "start_ms": 2985611,
        "end_ms": 3080111,
        "duration_ms": 94500
      }
    ],
    "revision_count": 0,
    "stuck": true
  },
  "scratch_work": [
    {
      "text": "πr²",
      "region_id": "r_scratch_q28",
      "confidence": 0.92
    }
  ],
  "key_moments": [
    {
      "label": "final_answer",
      "t_offset_ms": 2908311,
      "frame_id": "frame_00102"
    }
  ]
}